{
  "id": "react-app",
  "meta": {
    "name": "React Application",
    "category": "project",
    "version": "1.0.0",
    "description": "Modern React application with TypeScript, Tailwind CSS, and essential tooling",
    "tags": ["react", "typescript", "tailwindcss", "frontend"],
    "author": "AI Portfolio System",
    "createdAt": "2025-08-24T12:00:00.000Z",
    "lastModified": "2025-08-24T12:00:00.000Z"
  },
  "files": [
    {
      "path": "package.json",
      "content": "{\n  \"name\": \"{{PROJECT_NAME}}\",\n  \"version\": \"0.1.0\",\n  \"description\": \"{{PROJECT_DESCRIPTION}}\",\n  \"scripts\": {\n    \"dev\": \"vite\",\n    \"build\": \"vite build\",\n    \"preview\": \"vite preview\",\n    \"lint\": \"eslint src --ext .ts,.tsx\",\n    \"type-check\": \"tsc --noEmit\"\n  },\n  \"dependencies\": {\n    \"react\": \"^18.2.0\",\n    \"react-dom\": \"^18.2.0\"\n  },\n  \"devDependencies\": {\n    \"@types/react\": \"^18.2.0\",\n    \"@types/react-dom\": \"^18.2.0\",\n    \"@typescript-eslint/eslint-plugin\": \"^6.0.0\",\n    \"@typescript-eslint/parser\": \"^6.0.0\",\n    \"@vitejs/plugin-react\": \"^4.0.0\",\n    \"autoprefixer\": \"^10.4.14\",\n    \"eslint\": \"^8.45.0\",\n    \"eslint-plugin-react-hooks\": \"^4.6.0\",\n    \"eslint-plugin-react-refresh\": \"^0.4.3\",\n    \"postcss\": \"^8.4.27\",\n    \"tailwindcss\": \"^3.3.0\",\n    \"typescript\": \"^5.0.2\",\n    \"vite\": \"^4.4.5\"\n  }\n}"
    },
    {
      "path": "src/App.tsx",
      "content": "import React from 'react';\n\nfunction App() {\n  return (\n    <div className=\"min-h-screen bg-gray-100 flex items-center justify-center\">\n      <div className=\"bg-white p-8 rounded-lg shadow-md\">\n        <h1 className=\"text-3xl font-bold text-gray-900 mb-4\">\n          {{PROJECT_NAME}}\n        </h1>\n        <p className=\"text-gray-600\">\n          {{PROJECT_DESCRIPTION}}\n        </p>\n        <div className=\"mt-6\">\n          <button className=\"bg-blue-500 hover:bg-blue-700 text-white font-bold py-2 px-4 rounded\">\n            Get Started\n          </button>\n        </div>\n      </div>\n    </div>\n  );\n}\n\nexport default App;"
    },
    {
      "path": "src/main.tsx",
      "content": "import React from 'react';\nimport ReactDOM from 'react-dom/client';\nimport App from './App';\nimport './index.css';\n\nReactDOM.createRoot(document.getElementById('root')!).render(\n  <React.StrictMode>\n    <App />\n  </React.StrictMode>\n);"
    },
    {
      "path": "src/index.css",
      "content": "@tailwind base;\n@tailwind components;\n@tailwind utilities;\n\nbody {\n  margin: 0;\n  font-family: -apple-system, BlinkMacSystemFont, 'Segoe UI', 'Roboto', 'Oxygen',\n    'Ubuntu', 'Cantarell', 'Fira Sans', 'Droid Sans', 'Helvetica Neue',\n    sans-serif;\n  -webkit-font-smoothing: antialiased;\n  -moz-osx-font-smoothing: grayscale;\n}"
    },
    {
      "path": "index.html",
      "content": "<!doctype html>\n<html lang=\"en\">\n  <head>\n    <meta charset=\"UTF-8\" />\n    <link rel=\"icon\" type=\"image/svg+xml\" href=\"/vite.svg\" />\n    <meta name=\"viewport\" content=\"width=device-width, initial-scale=1.0\" />\n    <title>{{PROJECT_NAME}}</title>\n  </head>\n  <body>\n    <div id=\"root\"></div>\n    <script type=\"module\" src=\"/src/main.tsx\"></script>\n  </body>\n</html>"
    },
    {
      "path": "vite.config.ts",
      "content": "import { defineConfig } from 'vite';\nimport react from '@vitejs/plugin-react';\n\nexport default defineConfig({\n  plugins: [react()],\n  server: {\n    port: 3000,\n    open: true\n  }\n});"
    },
    {
      "path": "tailwind.config.js",
      "content": "/** @type {import('tailwindcss').Config} */\nexport default {\n  content: [\n    \"./index.html\",\n    \"./src/**/*.{js,ts,jsx,tsx}\",\n  ],\n  theme: {\n    extend: {},\n  },\n  plugins: [],\n};"
    },
    {
      "path": "tsconfig.json",
      "content": "{\n  \"compilerOptions\": {\n    \"target\": \"ES2020\",\n    \"useDefineForClassFields\": true,\n    \"lib\": [\"ES2020\", \"DOM\", \"DOM.Iterable\"],\n    \"module\": \"ESNext\",\n    \"skipLibCheck\": true,\n    \"moduleResolution\": \"bundler\",\n    \"allowImportingTsExtensions\": true,\n    \"resolveJsonModule\": true,\n    \"isolatedModules\": true,\n    \"noEmit\": true,\n    \"jsx\": \"react-jsx\",\n    \"strict\": true,\n    \"noUnusedLocals\": true,\n    \"noUnusedParameters\": true,\n    \"noFallthroughCasesInSwitch\": true\n  },\n  \"include\": [\"src\"],\n  \"references\": [{ \"path\": \"./tsconfig.node.json\" }]\n}"
    },
    {
      "path": "README.md",
      "content": "# {{PROJECT_NAME}}\n\n{{PROJECT_DESCRIPTION}}\n\n## Getting Started\n\nThis React application was created using the react-app template from the AI Portfolio system.\n\n### Prerequisites\n\n- Node.js 16+ \n- npm or yarn\n\n### Installation\n\n```bash\nnpm install\n```\n\n### Development\n\n```bash\nnpm run dev\n```\n\nOpen [http://localhost:3000](http://localhost:3000) to view in browser.\n\n### Building for Production\n\n```bash\nnpm run build\n```\n\n### Technologies Used\n\n- React 18 with TypeScript\n- Vite for fast development\n- Tailwind CSS for styling\n- ESLint for code quality\n\n### Project Structure\n\n```\nsrc/\n├── App.tsx          # Main application component\n├── main.tsx         # Application entry point\n└── index.css        # Global styles and Tailwind imports\n```\n\n## Deployment\n\nBuild artifacts will be in the `dist/` folder after running `npm run build`.\n\nDeploy to any static hosting service like Vercel, Netlify, or GitHub Pages."
    }
  ],
  "claudeMd": {
    "sections": [
      "## React Application Setup",
      "",
      "This project uses React 18 with TypeScript and Tailwind CSS.",
      "",
      "### Development Commands",
      "- `npm run dev` - Start development server",
      "- `npm run build` - Build for production",
      "- `npm run lint` - Run ESLint",
      "",
      "### File Structure Guidelines", 
      "- Keep components under 300 lines",
      "- Use TypeScript for all new files",
      "- Follow React hooks patterns",
      "- Use Tailwind classes for styling"
    ],
    "variables": {
      "FRAMEWORK": "React + TypeScript",
      "BUILD_TOOL": "Vite",
      "STYLING": "Tailwind CSS"
    },
    "instructions": [
      "Follow React best practices and hooks patterns",
      "Use TypeScript for type safety",
      "Keep components focused and under 300 lines",
      "Use Tailwind utility classes for consistent styling"
    ]
  },
  "variables": {
    "PROJECT_NAME": {
      "description": "Name of the React project",
      "default": "my-react-app",
      "required": true
    },
    "PROJECT_DESCRIPTION": {
      "description": "Brief description of what the app does",
      "default": "A modern React application",
      "required": true
    }
  },
  "dependencies": [
    {
      "name": "node",
      "version": ">=16.0.0",
      "type": "system"
    },
    {
      "name": "npm",
      "version": ">=8.0.0", 
      "type": "system"
    }
  ],
  "postCreate": [
    {
      "command": "npm install",
      "description": "Install project dependencies",
      "optional": false
    },
    {
      "command": "npm run dev",
      "description": "Start development server",
      "optional": true
    }
  ]
}